store_name,store_number,address,address2,city,state,zip_code,country,phone_number,latitude,longitude,store_hours,store_type,other_fields,coming_soon
Candlewood Suites Sheridan,,1709 Sugarland Drive,,Sheridan,WY,82801,United States,307-675-2100,,,,,,
Candlewood Suites Cheyenne,,2335 Tura Parkway,,Cheyenne,WY,82001,United States,307-634-6622,,,,,,
Candlewood Suites Sioux Falls,,2725 South Carolyn Avenue,,Sioux Falls,SD,57106,United States,605-361-3100,,,,,,
Candlewood Suites Gillette,,904 Country Club Road,,Gillette,WY,82718,United States,307-682-6100,,,,,,
Candlewood Suites Milwaukee Airport oak Creek,,6440 S 13th Street,,Oak Creek,WI,53154,United States,414-570-9999,,,,,,
Candlewood Suites Oak Harbor,,33221 State Road 20,,Oak Harbor,WA,98277,United States,360-279-2222,,,,,,
Candlewood Suites Lakewood,,10720 Pacific Highway Sw,,Lakewood,WA,98499,United States,253-584-0868,,,,,,
Candlewood Suites Olympia lacey,,4440 3rd Avenue Se,,Lacey,WA,98503,United States,360-491-1698,,,,,,
Candlewood Suites Burlington,,1866 South Burlington Blvd,,Burlington,WA,98233,United States,360-755-3300,,,,,,
Candlewood Suites Weatherford,,215 Alford Drive,,Weatherford,TX,76087,United States,817-599-9999,,,,,,
Candlewood Suites Wichita Falls Maurine St,,1320 Central Freeway,,Wichita Falls,TX,76305,United States,940-322-4400,,,,,,
Candlewood Suites Yorktown,,329 Commonwealth Drive,,Yorktown,VA,23693,United States,757-952-1120,,,,,,
Candlewood Suites Wilson,,2915 Independence Dr West,,Wilson,NC,27896,United States,252-291-9494,,,,,,
Candlewood Suites Syracuse airport,,5414 South Bay Road town Of Salina,,Syracuse,NY,13212,United States,315-454-8999,,,,,,
Candlewood Suites New York City Times Square,,339 W 39th Street,,New York,NY,10018,United States,212-967-2254,,,,,,
Candlewood Suites Nanuet,,20 Overlook Boulevard,,Nanuet,NY,10954,United States,845-371-4445,,,,,,
Candlewood Suites Watertown fort Drum,,26513 Herrick Drive,,Evans Mills,NY,13637,United States,315-629-6990,,,,,,
Candlewood Suites Syracuse,,6550 Baptist Way,,East Syracuse,NY,13057,United States,315-432-1684,,,,,,
Candlewood Suites Elmira,,198 Colonial Drive,,Elmira,NY,57106,United States,607-873-7676,,,,,,
Candlewood Suites Buffalo Amherst,,20 Flint Road,,Amherst,NY,14226,United States,716-688-2100,,,,,,
Candlewood Suites Roswell New Mexico,,4 Military Heights Drive,,Roswell,NM,88201,United States,575-623-4300,,,,,,
Candlewood Suites Albuquerque,,3025 Menaul Blvd,,Albuquerque,NM,87107,United States,505-888-3424,,,,,,
Candlewood Suites Wake Forest Raleigh Area,,12050 Retail Drive,,Wake Forest,NC,27587,United States,919-554-6901,,,,,,
Candlewood Suites Rocky Mount,,688 English Road,,Rocky Mount,NC,27804,United States,252-467-2550,,,,,,
Candlewood Suites New Bern,,3465 Dr Martin Luther King Jr Blv,,New Bern,NC,28562,United States,252-638-8166,,,,,,
Candlewood Suites Raleigh Crabtree,,4433 Lead Mine Road,,Raleigh,NC,27612,United States,919-789-4840,,,,,,
Candlewood Suites Mooresville,,3247 Charlotte Highway,,Mooresville,NC,28117,United States,704-360-4899,,,,,,
Candlewood Suites Jacksonville,,119 Penny Lane,,Jacksonville,NC,28546,United States,910-333-0494,,,,,,
Candlewood Suites Huntersville lake Norman Area,,16530 Northcross Drive,,Huntersville,NC,28078,United States,704-895-3434,,,,,,
Candlewood Suites Greenville West,,1055 Waterford Commons Drive,,Greenville,NC,27834,United States,252-317-3000,,,,,,
Candlewood Suites Durham,,1818 East Nc Hwy 54,,Durham,NC,27713,United States,919-484-9922,,,,,,
Candlewood Suites Fayetteville,,4108 Legend Ave,,Fayetteville,NC,28303,United States,910-868-0873,,,,,,
Candlewood Suites Charlotte University,,8812 University East Drive,,Charlotte,NC,28213,United States,704-598-9863,,,,,,
Candlewood Suites Apex Raleigh Area,,1005 Marco Drive,,Apex,NC,27502,United States,919-387-8595,,,,,,
Candlewood Suites Minot,,900 37th Ave Sw,,Minot,ND,58701,United States,701-858-7700,,,,,,
Candlewood Suites Fargo N Dakota State Univ,,1831 Ndsu Research Park Drive,,Fargo,ND,58102,United States,701-235-8200,,,,,,
Candlewood Suites Williston,,3716 6th Avenue West,,Williston,ND,58801,United States,701-572-3716,,,,,,
Candlewood Suites Bismarck,,4400 Skyline Crossings,,Bismarck,ND,58503,United States,701-751-8900,,,,,,
Candlewood Suites Williamsport,,1836 East Third St,,Williamsport,PA,17701,United States,570-601-9100,,,,,,
Candlewood Suites Washington North,,255 Meadowlands Boulevard,,Washington,PA,15301,United States,724-873-7300,,,,,,
Candlewood Suites Reading,,55 South 3rd Avenue,,Reading,PA,19611,United States,610-898-1910,,,,,,
Candlewood Suites Pittsburgh airport,,100 Chauvet Drive,,Pittsburgh,PA,15275,United States,412-787-7770,,,,,,
Candlewood Suites Philadelphia willow Grove,,250 Business Center Drive,,Horsham,PA,19044,United States,215-328-9119,,,,,,
Candlewood Suites Harrisburg - Hershey,,413 Port View Drive,,Harrisburg,PA,17111,United States,717-561-9400,,,,,,
Candlewood Suites Hazleton,,9 Bowman s Mill Road,,Hazleton,PA,18202,United States,570-459-1600,,,,,,
Candlewood Suites Harrisburg,,504 North Mountain Rd,,Harrisburg,PA,17112,United States,717-652-7800,,,,,,
Candlewood Suites Pittsburgh-Cranberry,,20036 Route 19 Oak Tree Place,,Cranberry Township,PA,16066,United States,724-591-8666,,,,,,
Candlewood Suites Chambersburg,,231 Walker Road,,Chambersburg,PA,17201,United States,717-263-2800,,,,,,
Candlewood Suites Portland airport,,11250 N e Holman,,Portland,OR,97220,United States,503-255-4003,,,,,,
Candlewood Suites Medford,,3548 Heathrow Way,,Medford,OR,97504-4004,United States,541-772-2800,,,,,,
Candlewood Suites Perrysburg,,27350 Lake Vue Drive,,Perrysburg,OH,43551,United States,419-872-6161,,,,,,
Candlewood Suites Cleveland n Olmsted,,24741 Country Club Blvd,,North Olmsted,OH,44070,United States,440-716-0584,,,,,,
Candlewood Suites Columbus Airport,,590 Taylor Road,,Gahanna,OH,43230,United States,614-863-4033,,,,,,
Candlewood Suites Polaris,,8515 Lyra Drive,,Columbus,OH,43240,United States,614-436-6600,,,,,,
Candlewood Suites Woodward,,3350 Oklahoma Ave,,Woodward,OK,73801,United States,405-481-6990,,,,,,
Candlewood Suites Tulsa,,10008 E 73rd Street South,,Tulsa,OK,74133,United States,918-294-9000,,,,,,
Candlewood Suites Owasso,,11699 E 96th Street North,,Owasso,OK,74055,United States,918-272-4334,,,,,,
Candlewood Suites Oklahoma City,,4400 River Park Drive,,Oklahoma City,OK,73108,United States,405-680-8770,,,,,,
Candlewood Suites McAlester,,425 S George Nigh Expressway,,Mcalester,OK,74501,United States,918-426-4171,,,,,,
Candlewood Suites Oklahoma City moore,,1701 North Moore Ave,,Moore,OK,73160,United States,405-735-5151,,,,,,
Candlewood Suites Lawton Fort Sill,,940 Nw 38th Street,,Lawton,OK,73505,United States,580-354-9906,,,,,,
Candlewood Suites Midwest City,,5300 Main Street,,Del City,OK,73115,United States,405-604-5300,,,,,,
Candlewood Suites Bartlesville East,,3812 S e Washington Place,,Bartlesville,OK,74006,United States,918-766-0044,,,,,,
Candlewood Suites Ardmore,,2602 Rina Park Road,,Ardmore,OK,73401,United States,580-226-0100,,,,,,
Candlewood Suites Winchester,,1135 Millwood Pike And Rt 50,,Winchester,VA,22602,United States,540-667-8323,,,,,,
Candlewood Suites Virginia Beach Norfolk,,4437 Bonney Road,,Virginia Beach,VA,23462,United States,757-213-1500,,,,,,
Candlewood Suites Washington Dulles Sterling,,45520 Severn Way,,Sterling,VA,20166,United States,703-674-2288,,,,,,
Candlewood Suites Richmond South,,4301 Commerce Road,,Richmond,VA,23234,United States,804-271-0016,,,,,,
Candlewood Suites Richmond Airport,,5400 Audubon Drive,,Richmond,VA,23231,United States,804-652-1888,,,,,,
Candlewood Suites Norfolk Airport,,5600 Lowery Road,,Norfolk,VA,23502,United States,757-605-4001,,,,,,
Candlewood Suites Manassas,,11220 Balls Ford Road,,Manassas,VA,20109,United States,703-530-0550,,,,,,
Candlewood Suites Ft Lee Petersburg Hopewell,,5113 Plaza Drive,,Hopewell,VA,23860,United States,804-541-0200,,,,,,
Candlewood Suites Washington dulles Herndon,,13845 Sunrise Valley Drive,,Herndon,VA,20171,United States,703-793-7100,,,,,,
Candlewood Suites Harrisonburg,,1560 Country Club Road,,Harrisonburg,VA,22801,United States,540-437-1400,,,,,,
Candlewood Suites Hampton,,401 Butler Farm Road,,Hampton,VA,23666,United States,757-766-8976,,,,,,
Candlewood Suites Richmond West End Short Pump,,4120 Brookriver Drive,,Glen Allen,VA,23060,United States,804-364-2000,,,,,,
Candlewood Suites Fredericksburg Va,,4821 Crossings Court,,Fredericksburg,VA,22407,United States,540-376-7244,,,,,,
Candlewood Suites Richmond North glen Allen,,10609 Telegraph Road,,Glen Allen,VA,23059,United States,804-262-2240,,,,,,
Candlewood Suites Washington fairfax,,11400 Random Hills Road,,Fairfax,VA,22030,United States,703-359-4490,,,,,,
Candlewood Suites Colonial Heights,,15820 Woods Edge Road,,Colonial Heights,VA,23834,United States,804-526-0111,,,,,,
Candlewood Suites Chesapeake Suffolk,,4809 Market Place,,Chesapeake,VA,23321,United States,757-405-3030,,,,,,
Candlewood Suites Alexandria - Fort Belvoir,,8847 Richmond Highway,,Alexandria,VA,22309,United States,703-780-1111,,,,,,
Candlewood Suites Victoria,,7103 N Navarro Street,,Victoria,TX,77904,United States,361-578-0236,,,,,,
Candlewood Suites Tyler,,315 Rieck Rd,,Tyler,TX,75703,United States,903-509-4131,,,,,,
Candlewood Suites Houston the Woodlands,,17525 St Lukes Way,,The Woodlands,TX,77384,United States,936-271-2100,,,,,,
Candlewood Suites Texas City,,1700 Hwy 146 North,,Texas City,TX,77590,United States,409-945-6500,,,,,,
Candlewood Suites Texarkana,,2901 S Cowhorn Creek Loop,,Texarkana,TX,75503,United States,903-334-7418,,,,,,
Candlewood Suites Temple,,1850 Scott Blvd And 37th Street Nw,,Temple,TX,76504,United States,254-773-8342,,,,,,
Candlewood Suites San Marcos,,600 Wonderworld Drive,,San Marcos,TX,78666,United States,512-749-1717,,,,,,
Candlewood Suites San Antonio Nw Near Seaworld,,9502 Amelia Pass,,San Antonio,TX,78254,United States,210-523-7666,,,,,,
Candlewood Suites San Antonio Nw Medical Center,,9350 IH 10 West,,San Antonio,TX,78230,United States,210-615-0550,,,,,,
Candlewood Suites San Antonio N Stone Oak Area,,21103 Encino Commons Blvd,,San Antonio,TX,78259,United States,210-545-2477,,,,,,
Candlewood Suites San Antonio Downtown,,1024 S Laredo Street,,San Antonio,TX,78204,United States,210-226-7700,,,,,,
Candlewood Suites Dallas Plano East Richardson,,2401 E George Bush Turnpike,,Plano,TX,75074,United States,214-474-2770,,,,,,
Candlewood Suites Dallas plano,,4701 Legacy Drive,,Plano,TX,75024,United States,972-618-5446,,,,,,
Candlewood Suites Pearland,,9015 Broadway,,Pearland,TX,77584,United States,281-412-7400,,,,,,
Candlewood Suites Odessa,,750 John Ben Shepperd Parkway,,Odessa,TX,79761,United States,432-272-4567,,,,,,
Candlewood Suites New Braunfels,,1471 Ih 35 North,,New Braunfels,TX,78130,United States,830-387-4014,,,,,,
Candlewood Suites Port Arthur nederland,,2125 Hwy 69,,Nederland,TX,77627,United States,409-729-9543,,,,,,
Candlewood Suites Mount Pleasant,,2407 S Jefferson Hwy Us 271,,Mount Pleasant,TX,75455,United States,903-572-4600,,,,,,
Candlewood Suites Monahans,,1902 S. Stockton Avenue,,Monahans,TX,79756,United States,432-943-4800,,,,,,
Candlewood Suites La Porte,,1250 S 13th St,,La Porte,TX,77571,United States,281-471-0555,,,,,,
Candlewood Suites League City,,2350 Gulf Freeway South,,League City,TX,77573,United States,281-534-9848,,,,,,
Candlewood Suites Longview,,2904 Tuttle Blvd,,Longview,TX,75605,United States,903-663-9751,,,,,,
Candlewood Suites Lake Jackson,,506 E Hwy 332,,Lake Jackson,TX,77566,United States,979-297-0011,,,,,,
Candlewood Suites Houston Kingwood,,291 Kingwood Medical Center,,Kingwood,TX,77339,United States,281-713-8989,,,,,,
Candlewood Suites Houston Park 10,,19998 Park Row Drive,,Katy,TX,77449,United States,281-578-9993,,,,,,
Candlewood Suites Killeen,,2300 Florence Rd,,Killeen,TX,76541,United States,254-501-3990,,,,,,
Candlewood Suites Irving,,5300 Green Park Drive,,Irving,TX,75038,United States,972-714-9990,,,,,,
Candlewood Suites Houston West,,11280 Westheimer Road,,Houston,TX,77042,United States,713-244-0400,,,,,,
Candlewood Suites Houston Westchase,,4033 W Sam Houston Parkway,,Houston,TX,77042,United States,713-780-7881,,,,,,
Candlewood Suites NW Willowbrook,,8719 FM 1960 West,,Houston,TX,77070,United States,832-237-7300,,,,,,
Candlewood Suites Houston Town and Country,,10503 Town Country Way,,Houston,TX,77024,United States,713-464-2677,,,,,,
Candlewood Suites Houston Medical Center,,10025 South Main Street,,Houston,TX,77025,United States,713-665-3300,,,,,,
Candlewood Suites Houston Iah Beltway 8,,1500 North Sam Houston Parkway,,Houston,TX,77032,United States,281-987-3900,,,,,,
Candlewood Suites Houston I 10 East,,1020 Maxey Road,,Houston,TX,77015,United States,713-453-3337,,,,,,
Candlewood Suites Houston clear Lake,,2737 Bay Area Blvd,,Houston,TX,77058,United States,281-461-3060,,,,,,
Candlewood Suites Georgetown,,451 North Ih 35,,Georgetown,TX,78628,United States,512-591-7888,,,,,,
Candlewood Suites Houston By The Galleria,,4900 Loop Central Drive,,Houston,TX,77081,United States,713-839-9411,,,,,,
Candlewood Suites Galveston,,808 61st Street,,Galveston,TX,77551,United States,409-744-4440,,,,,,
Candlewood Suites West Fort Worth,,402 N Jim Wright Freeway,,Fort Worth,TX,76108,United States,817-246-6800,,,,,,
Candlewood Suites DFW South,,4200 Reggis Drive,,Fort Worth,TX,76155,United States,817-868-1900,,,,,,
Candlewood Suites Dallas Ft Worth fossil Creek,,5201 Endicott Avenue,,Fort Worth,TX,76137,United States,817-838-8229,,,,,,
Candlewood Suites Fort Stockton,,2469 W Ih 10,,Fort Stockton,TX,79735,United States,432-336-7700,,,,,,
Candlewood Suites Deer Park,,1300 East Blvd,,Deer Park,TX,77536,United States,281-478-0200,,,,,,
Candlewood Suites El Paso,,4631 Cohen Ave,,El Paso,TX,79924,United States,915-755-9000,,,,,,
Candlewood Suites Decatur,,601 W Thompson Rd,,Decatur,TX,76234,United States,940-627-5480,,,,,,
Candlewood Suites Dallas Park Central,,12525 Greenville Avenue,,Dallas,TX,75243,United States,972-669-9606,,,,,,
Candlewood Suites Dallas market Center,,7930 North Stemmons Freeway,,Dallas,TX,75247,United States,214-631-3333,,,,,,
Candlewood Suites Corpus Christi spid,,5014 Crosstown Expressway,,Corpus Christi,TX,78416,United States,361-853-3413,,,,,,
Candlewood Suites Dallas By The Galleria,,13939 Noel Road,,Dallas,TX,75240,United States,972-233-6888,,,,,,
Candlewood Suites Austin N cedar Park,,1100 Cottonwood Creek Trail,,Cedar Park,TX,78613,United States,512-986-4825,,,,,,
Candlewood Suites Austin N-Cedar Park,,1100 Cottonwood Creek Trail,,Cedar Park,TX,78613,United States,512-986-4829,,,,,,
Candlewood Suites Baytown,,6126 Garth Road,,Baytown,TX,77521,United States,281-421-2300,,,,,,
Candlewood Suites Austin South,,4320 Interstate 35 Service St,,Austin,TX,78745,United States,512-444-8882,,,,,,
Candlewood Suites Austin round Rock,,521 South Ih 35,,Austin,TX,78745,United States,512-828-0899,,,,,,
Candlewood Suites Austin Arboretum northwest,,9701 Stonelake Blvd,,Austin,TX,78759,United States,512-338-1611,,,,,,
Candlewood Suites Dallas arlington,,2221 Brookhollow Plaza Dr,,Arlington,TX,76006,United States,817-649-3336,,,,,,
Candlewood Suites Amarillo-Western Crossing,,18 Western Plaza Drive,,Amarillo,TX,79102,United States,806-418-2661,,,,,,
Candlewood Suites Abilene,,3050 Catclaw Dr,,Abilene,TX,79606,United States,325-437-4741,,,,,,
Candlewood Suites Sumter,,2541 Broad Street,,Sumter,SC,29150,United States,803-469-4000,,,,,,
Candlewood Suites I 26 Northwoods Mall,,2177 Northwoods Blvd,,North Charleston,SC,29406,United States,843-797-3535,,,,,,
Candlewood Suites Greenville,,25 Green Heron Road,,Greenville,SC,29607,United States,864-281-1000,,,,,,
Candlewood Suites Salt Lake City airport,,2170 W North Temple,,Salt Lake City,UT,84116,United States,801-359-7500,,,,,,
Candlewood Suites Columbia Ft Jackson,,921 Atlas Road,,Columbia,SC,29209,United States,803-727-1299,,,,,,
Candlewood Suites Bluffton,,5 Young Clyde Court,,Bluffton,SC,29909,United States,843-705-9600,,,,,,
Candlewood Suites Murfreesboro,,850 North Thompson Lane,,Murfreesboro,TN,37129,United States,615-617-3075,,,,,,
Candlewood Suites Memphis,,7950 Centennial Drive,,Memphis,TN,38125,United States,901-755-0877,,,,,,
Candlewood Suites Knoxville,,10206 Parkside Drive,,Knoxville,TN,37922,United States,865-777-0400,,,,,,
Candlewood Suites Clarksville,,3050 Clay Lewis Road,,Clarksville,TN,37040,United States,931-906-0900,,,,,,
Candlewood Suites Knoxville Airport Alcoa,,176 Cusick Road,,Alcoa,TN,37701,United States,865-233-4411,,,,,,
Candlewood Suites Nashville brentwood,,5129 Virginia Way,,Brentwood,TN,37027,United States,615-309-0600,,,,,,
Candlewood Suites Fitchburg,,5421 Caddis Bend,,Madison,WI,53711,United States,608-271-3400,,,,,,
Candlewood Suites La Crosse,,56 Copeland Avenue,,La Crosse,WI,54603,United States,608-785-1110,,,,,,
Candlewood Suites Kenosha,,10200 74th Street,,Kenosha,WI,53142,United States,262-842-5000,,,,,,
Candlewood Suites Milwaukee Brown Deer,,4483 West Schroeder Drive,,Brown Deer,WI,53223,United States,414-355-3939,,,,,,
Candlewood Suites Appleton,,4525 West College Avenue,,Appleton,WI,54914,United States,920-739-8000,,,,,,
Candlewood Suites Logan,,743 Stratton Street,,Logan,WV,25601,United States,304-752-8650,,,,,,
Candlewood Suites Somerset,,41 Worlds Fair Drive,,Somerset,NJ,8873,United States,732-748-1400,,,,,,
Candlewood Suites Secaucus jersey City Area,,279 Secaucus Road,,Secaucus,NJ,7094,United States,201-865-3900,,,,,,
Candlewood Suites St. Joseph,,3505 North Village Drive,,St Joseph,MO,64506,United States,816-232-2600,,,,,,
Candlewood Suites Minneapolis,,351 West 77th St,,Richfield,MN,55423,United States,612-869-7704,,,,,,
Candlewood Suites Vicksburg,,1296 South Frontage Rd,,Vicksburg,MS,39180,United States,601-638-6900,,,,,,
Candlewood Suites Tupelo North,,979 North Gloster St,,Tupelo,MS,38804,United States,662-553-4649,,,,,,
Candlewood Suites Detroit troy,,2550 Troy Center Drive,,Troy,MI,48084,United States,248-269-6600,,,,,,
Candlewood Suites Detroit warren,,7010 Convention Blvd,,Warren,MI,48092,United States,586-978-1261,,,,,,
Candlewood Suites St Joseph benton Harbor,,2567 Marquette Woods Road,,Stevensville,MI,49127,United States,269-428-4400,,,,,,
Candlewood Suites Baltimore linthicum,,1247 Winterson Rd,,Linthicum,MD,21090,United States,410-850-9214,,,,,,
Candlewood Suites Wichita northeast,,3141 North Webb Rd,,Wichita,KS,67226,United States,316-634-6070,,,,,,
Candlewood Suites Des Moines,,7625 Office Plaza Drive North,,West Des Moines,IA,50266,United States,515-221-0001,,,,,,
Candlewood Suites Waterloo Cedar Falls,,2056 La Porte Rd,,Waterloo,IA,50702,United States,319-235-7000,,,,,,
Candlewood Suites Terre Haute,,721 Wabash Avenue,,Terre Haute,IN,47807,United States,812-234-3400,,,,,,
Candlewood Suites Wichita airport,,570 South Julia,,Wichita,KS,67209,United States,316-942-0400,,,,,,
Candlewood Suites South Bend Airport,,3916 Lincolnway West,,South Bend,IN,46628,United States,574-968-1072,,,,,,
Candlewood Suites Warner Robins robins Afb,,110 Willie Lee Parkway,,Warner Robins,GA,31088,United States,478-333-6850,,,,,,
Candlewood Suites Tallahassee,,2815 Lakeshore Drive,,Tallahassee,FL,32312,United States,850-597-7000,,,,,,
Candlewood Suites Windsor Locks,,149 Ella Grasso Turnpike,,Windsor Locks,CT,6096,United States,860-623-2000,,,,,,
Candlewood Suites Miami Airport West,,8855 Northwest 27th Street,,Miami,FL,33172,United States,305-591-9099,,,,,,
Candlewood Suites Melbourne viera,,2930 Pineda Plazaway,,Melbourne,FL,32940,United States,321-821-9009,,,,,,
Candlewood Suites Lake Mary,,1130 Greenwood Blvd,,Lake Mary,FL,32746,United States,407-585-3000,,,,,,
Candlewood Suites Jacksonville East Merril Road,,2700 Jane Street,,Jacksonville,FL,32225,United States,904-744-1244,,,,,,
Candlewood Suites Jacksonville,,4990 Belfort Road,,Jacksonville,FL,32256,United States,904-296-7785,,,,,,
Candlewood Suites Ft Myers I 75,,3626 Colonial Court,,Fort Myers,FL,33913,United States,239-344-4400,,,,,,
Candlewood Suites Fort Myers sanibel Gateway,,9740 Commerce Center Court,,Fort Myers,FL,33908,United States,239-210-7777,,,,,,
Candlewood Suites Ft Lauderdale Airport Cruise,,1120 W State Road 84,,Fort Lauderdale,FL,33315,United States,954-522-8822,,,,,,
Candlewood Suites Destin Miramar Beach,,11396 Us 98 West,,Destin,FL,32550,United States,850-337-3770,,,,,,
Candlewood Suites Clearwater,,13231 49th Steet North,,Clearwater,FL,33762,United States,727-573-3344,,,,,,
Candlewood Suites Boise meridian,,1855 S Silverstone Way,,Meridian,ID,83642,United States,208-888-5121,,,,,,
Candlewood Suites Idaho Falls,,665 Pancheri Dr,,Idaho Falls,ID,83402,United States,208-525-9800,,,,,,
Candlewood Suites Boise Towne Square,,700 North Cole Road,,Boise,ID,83704,United States,208-322-4300,,,,,,
Candlewood Suites Savannah Airport,,50 Stephens S Green Dr,,Savannah,GA,31408,United States,912-966-9644,,,,,,
Candlewood Suites Macon,,3957 Riverplace Drive,,Macon,GA,31210,United States,478-254-3530,,,,,,
Candlewood Suites Athens,,156 Classic Road,,Athens,GA,30622,United States,706-548-9663,,,,,,
Candlewood Suites Augusta,,1080 Claussen Road,,Augusta,GA,30907,United States,706-733-3300,,,,,,
Candlewood Suites Columbus,,3389 Victory Drive,,Columbus,GA,31903,United States,706-683-9900,,,,,,
Candlewood Suites Atlanta,,3665 Shackleford Road,,Duluth,GA,30096,United States,678-380-0414,,,,,,
Candlewood Suites Atlanta West I-20,,913 Bob Arnold Boulevard,,Lithia Springs,GA,30122,United States,678-238-1980,,,,,,
Candlewood Suites Chicago Waukegan,,1151 S Waukegan Rd,,Waukegan,IL,60085,United States,847-578-5250,,,,,,
Candlewood Suites Chicago Naperville,,27 West 300 Warrenville Road,,Warrenville,IL,60555,United States,630-836-1650,,,,,,
Candlewood Suites Springfield,,2501 Sunrise Drive,,Springfield,IL,62703,United States,217-522-5100,,,,,,
Candlewood Suites Rockford,,7555 Walton Street,,Rockford,IL,61108,United States,815-229-9300,,,,,,
Candlewood Suites Chicago o hare,,4021 North Mannheim Road,,Schiller Park,IL,60176,United States,847-671-4663,,,,,,
Candlewood Suites Ofallon Il St Louis Area,,1332 Park Plaza Drive,,O Fallon,IL,62269,United States,618-622-9555,,,,,,
Candlewood Suites Peoria At Grand Prairie,,5300 W Landens Way,,Peoria,IL,61614,United States,309-691-1690,,,,,,
Candlewood Suites Bloomington normal,,203 Susan Drive,,Normal,IL,61704,United States,309-862-4100,,,,,,
Candlewood Suites Libertyville,,1100 N Us Highway 45,,Libertyville,IL,60048,United States,847-247-9900,,,,,,
Candlewood Suites Elgin,,1780 Capital Street,,Elgin,IL,60124,United States,847-888-0600,,,,,,
Candlewood Suites Champaign urbana Univ Area,,1917 Moreland Blvd,,Champaign,IL,61822,United States,217-398-1000,,,,,,
Candlewood Suites Aurora,,2625 West Sullivan Rd,,Aurora,IL,60506,United States,630-907-9977,,,,,,
Candlewood Suites Lafayette,,240 Meijer Drive,,Lafayette,IN,47905,United States,765-807-5735,,,,,,
Candlewood Suites Merrillville,,8339 Ohio Street,,Merrillville,IN,46410,United States,219-791-9100,,,,,,
Candlewood Suites Indianapolis Northwest,,7455 Woodland Drive,,Indianapolis,IN,46278,United States,317-298-8000,,,,,,
Candlewood Suites Indianapolis East,,7040 E 21st Street,,Indianapolis,IN,46219,United States,317-495-6600,,,,,,
Candlewood Suites Indianapolis Dwtn Medical Dist,,1152 N White River Pkwy,,Indianapolis,IN,46222,United States,317-536-7700,,,,,,
Candlewood Suites Indianapolis Airport,,5250 W Bradbury Street,,Indianapolis,IN,46241,United States,317-241-9595,,,,,,
Candlewood Suites Indianapolis,,8111 Bash Street,,Indianapolis,IN,46250,United States,317-595-9292,,,,,,
Candlewood Suites Indianapolis South,,1190 N Graham Road,,Greenwood,IN,46143,United States,317-882-4300,,,,,,
Candlewood Suites Fort Wayne Nw,,5251 Distribution Drive,,Fort Wayne,IN,46825,United States,260-484-1400,,,,,,
Candlewood Suites Elkhart,,300 North Pointe Blvd,,Elkhart,IN,46514,United States,574-262-8600,,,,,,
Candlewood Suites Louisville North,,1419 Bales Lane,,Clarksville,IN,47129,United States,812-284-6113,,,,,,
Candlewood Suites Salina,,2650 Planet Avenue,,Salina,KS,67401,United States,785-823-6939,,,,,,
Candlewood Suites Kansas City overland Park,,11001 Oakmont,,Overland Park,KS,66210,United States,913-469-5557,,,,,,
Candlewood Suites Candlewood Suites Olathe,,15490 South Rogers Road,,Olathe,KS,66062,United States,913-768-8888,,,,,,
Candlewood Suites Kansas City,,10920 Parallel Parkway,,Kansas City,KS,66109,United States,913-788-9929,,,,,,
Candlewood Suites Manhattan,,210 Blue Earth Place,,Manhattan,KS,66502,United States,785-320-7995,,,,,,
Candlewood Suites Junction City Ft Riley,,100 S Hammons Dr,,Junction City,KS,66441,United States,785-238-1454,,,,,,
Candlewood Suites Emporia,,2602 Candlewood Drive,,Emporia,KS,66801,United States,620-343-7756,,,,,,
Candlewood Suites Radcliff Fort Knox,,100 Endeavour Way,,Radcliff,KY,40160,United States,270-351-3333,,,,,,
Candlewood Suites Louisville Airport,,1367 Gardiner Lane,,Louisville,KY,40213,United States,502-357-3577,,,,,,
Candlewood Suites Paducah,,3940 Coleman Crossing Circle,,Paducah,KY,42001,United States,270-442-3969,,,,,,
Candlewood Suites Bowling Green,,540 Wall Street,,Bowling Green,KY,42103,United States,270-843-5505,,,,,,
Candlewood Suites Lexington,,603 Ad Color Drive,,Lexington,KY,40511,United States,859-967-1940,,,,,,
Candlewood Suites Arundel Mills / BWI Airport,,1525 Dorsey Road,,Hanover,MD,21076,United States,410-691-0550,,,,,,
Candlewood Suites Aberdeen edgewood bel Air,,4216 Philadelphia Road,,Bel Air,MD,21015,United States,410-914-3060,,,,,,
Candlewood Suites Lake Charles sulphur,,320 Arena Road,,Sulphur,LA,70665,United States,337-528-5777,,,,,,
Candlewood Suites New Iberia,,2600 Hwy 14,,New Iberia,LA,70560,United States,337-256-8113,,,,,,
